Id,Name,Zone,Toldescribe,Description,Tel,Add,Zipcode,Region,Town,Travellinginfo,Opentime,Picture1,Picdescribe1,Picture2,Picdescribe2,Picture3,Picdescribe3,Map,Gov,Px,Py,Orgclass,Class1,Class2,Class3,Level,Website,Parkinginfo,Parkinginfo_Px,Parkinginfo_Py,Ticketinfo,Remarks,Keyword,Changetime,seg,year
C1_376430000A_000972,楓樹坑,,農田、老樹、鄉間小路，原來桃園也有伯朗大道?想徜徉在完美花海，原來不是只能在大溪！境內有三個谷地的楓樹坑(又名楓樹村)，因早先時候種滿了楓樹而得名，現雖不見楓林片片的景象，倒是可以在不同季節觀賞迎風搖曳的綠色稻浪、滿山頭白茫茫的芒草、五月桐花紛飛、太陽花怒展夏日氣息等景象，隨興漫步、騎單車遊逛就是一大享受。   由光明街290巷左轉直行約160公尺來到賞花路線－中坑線、風尾坑線交叉口。中坑線一路延伸至中坑五號橋前的土地公廟，全程約4公里，坡度略大於風尾坑線。沿途除了一些小型工廠，便是一畦一畦的農田，人口密度低的楓樹坑有著鄉村獨有的悠閒感；微風與待熟的莊稼正對話，空氣中飄著火龍果香，白鷺鷥優雅飛翔，蟲鳴鳥叫成了不成調的鄉間民謠。11月收割後，農人撒上波斯菊、向日葵、百日草，農田成了花田，綺麗花色總讓人忍不住駐足。而分岔路的另一線－風尾坑線，全程約5公里，蜿蜒小路上，屹立著一棵超過兩百歲的老楓香，是楓樹坑最有名氣的地標，許多人特別前來這「北部版伯朗大道｣朝聖，老樹下乘涼喝茶，一邊欣賞藍天綠海，放空是在此時唯一需要做的事。風尾坑線的農地面積較中坑線還大，不時能見到因應地勢而比道路還高的梯田。農閒時同樣有著波斯菊、百日花海盛開，遠眺山谷，夏天桐花，秋天白芒各自爭艷，構成一片多采風景。,面向田野，讓感官被遠處的山、吹拂的風、眼前的綠而喚醒，接著在百年楓香樹下打卡，記錄邂逅另一條伯朗大道的心情記事。,886-3-3322101,桃園市333龜山區楓樹里中坑街、風尾街,333.0,桃園市,龜山區,■欲前往中坑街，可搭乘桃園免費公車L325【中坑線】，至光明街290巷、中坑6號、光宏橋、中坑二號橋、中坑17號、中坑五號橋、中坑一等沿線站牌下皆可抵■欲前往風尾街，可搭乘桃園免費公車L325【中坑線】，至光明街290巷、風尾坑一、風尾坑二、風尾坑20號、風尾坑23號、風尾坑三、風尾坑四等沿線站牌下皆可抵,全年無休,https://travel.tycg.gov.tw/content/images/attractions/8395/640x480_image635591664152662543.jpg,花草盛開,,,,,,376430000A,121.34236,25.01372,,11,,,,,路邊停車,,,,"沿途多是產業道路無路燈， 路面狹小,，不適宜晚上開車前往。",,2022/11/1 16:29,"['坑線', '風尾', '楓樹坑', '波斯菊', '農田', '鄉間', '原來', '桐花', '中坑線', '一畦', '百日', '全程', '大道', '景象', '稻浪', '花田', '公里', '老樹', '桃園', '有伯朗', '境內', '三個', '楓樹村', '時候', '種滿', '楓樹', '雖不見', '楓林', '季節', '觀賞', '風搖曳', '綠色', '滿山頭', '芒草', '紛飛', '太陽花', '怒展', '氣息', '隨興', '騎單', '車遊', '290', '左轉', '160', '賞花', '路線', '中坑', '五號', '橋前', '工廠', '鄉村', '獨有', '悠閒感', '微風', '莊稼正', '空氣', '中飄著', '火龍', '白鷺鷥', '優雅', '飛翔', '蟲鳴', '民謠', '11', '農人', '農田成', '綺麗', '總讓', '駐足', '而分', '一線', '超過', '兩百歲', '老楓', '氣的', '地標', '許多人', '特別', '前來', '版伯朗', '朝聖', '老樹下', '乘涼', '一邊', '欣賞', '藍天', '綠海', '此時', '積較', '還大', '不時', '因應', '地勢', '還高', '農閒時', '同樣', '遠眺', '白芒', '爭艷', '構成', '采風景', '花海', '果香', '土地公', '徜徉', '放空', '大溪', '片片', '公尺', '直行', '白茫茫', '岔路', '屹立', '漫步', '海盛', '梯田', '花色', '向日葵', '夏日', '人口密度', '早先', '收割', '蜿蜒', '坡度', '喝茶', '沿途', '交叉口', '小路', '秋天', '山谷', '一棵', '光明', '谷地', '五月', '完美', '又名', '有名', '夏天', '延伸', '得名', '小型', '不成', '忍不住', '一大', '享受', '一路', '路上', '便是', '各自', '道路']",2022
C1_376430000A_000980,憲光二村,,來到被現代社區住宅包圍的憲光二村，安靜的老房子、斑駁的牆面、老樹枯葉，彷彿與世隔絕，時間靜止在某一刻，有一種經歷滄桑，可以分享許多老故事的氛圍。由第一排眷舍入口處走進來，便可以看到「中華民國眷村資源中心」設在此處，是針對全國眷村串流的平台，中心以蒐集、教育、交流、推廣、跨域為主軸，盤點統整眷村資源，將珍貴記憶傳承下去，因此，憲光二村就是能夠提供寶貴資源的眷村之一。憲光二村平房式的眷舍，以一排排的座落方式排列，眷舍右側的中央榕樹廣場，是以往孩子玩耍、大人聊天的所在，50多年過去，當年種下的小樹已變成老榕樹，繼續庇蔭著這片土地。此外，這裡也是當年憲兵司令部來村裡播放愛國電影的地方，廣場瞬間變身露天電影院。值得一提的還有憲光二村44、45號，為當年自治會及婦工隊的行政空間，提供村民集會、辦活動，暑假期間憲兵司令部還會派大專兵利用自治會的空間教小朋友書法、英文等課程，像是現代的暑期安親班，目前仍保有原貌。憲光二村目前正在進行修復工程，開放的部份空間仍有活動展示、課程體驗、藝術創作...等各式活動，要將眷村文化再加以活化。若是嚮往眷村文化，走讀眷村人文歷史，來一趟憲光二村，絕對是一場獨特的文化巡禮。,走訪全桃園唯一的憲兵宿舍，裝載歲月的老皮箱、連排黑瓦平房、飄揚的國旗、老榕樹下的鞦韆...，拼湊記憶中光陰的故事。,886-3-3197132,桃園市333龜山區大同路138巷,333.0,桃園市,龜山區,桃園客運於統領百貨站上車，搭乘137號公車(桃園-銘傳大學路線)，至龜山鄉農會或大同路口，於自強南路明德路口(農會、全家路口)直行，可看到憲光二村指示牌，左轉到達目的地,週三至週六09:00~17:00,https://travel.tycg.gov.tw/content/images/attractions/81922/640x480_attractions-image-jj8cp6nwveo0quoweq6tkq.jpg,憲光二村的中央榕樹廣場是村子裡主要的活動空間,,,,,,376430000A,121.34216,24.99215,,1,,,,,,,,免費,￭15人以下團體可於一週電話預約導覽服務￭每月開館日以臉書專頁公告為準,,2022/10/7 13:08,"['眷村', '憲光二村', '眷舍', '資源', '空間', '現代', '廣場', '當年', '憲兵', '課程', '活動', '文化', '自治', '司令部', '社區', '包圍', '安靜', '斑駁', '牆面', '老樹', '枯葉', '世隔絕', '時間', '靜止', '一種', '經歷', '滄桑', '許多', '氛圍', '進來', '中華民國', '設在', '此處', '針對', '全國', '串流', '蒐集', '推廣', '跨域', '主軸', '盤點', '統整', '將珍貴', '記憶', '傳承', '能夠', '寶貴', '右側', '榕樹', '50', '過去', '當年種', '小樹', '變成', '老榕樹', '繼續', '庇蔭著', '這片', '這裡', '村裡', '愛國', '電影', '瞬間', '變身', '還有', '44', '45', '會及', '婦工隊', '集會', '辦活動', '期間', '還會', '專兵', '書法', '安親', '進行', '開放', '體驗', '藝術', '創作', '...', '要將', '走讀', '歷史', '絕對', '一場', '獨特', '巡禮', '暑期', '座落', '第一排', '值得一提', '老房子', '原貌', '部份', '小朋友', '中心', '一排排', '暑假', '影院', '提供', '活化', '平房', '各式', '玩耍', '保有', '露天', '播放', '聊天', '人文', '入口', '一刻', '目前', '英文', '分享', '一趟', '村民', '展示', '住宅', '可以', '排列', '交流', '以往', '所在', '加以', '像是', '大人', '平台', '故事', '行政', '工程', '教育', '下去', '多年', '土地', '孩子', '中央', '利用', '此外', '看到', '方式', '正在', '之一', '地方', '因此', '就是']",2022
C1_376430000A_000981,眷村故事館,,位於龜山區光峰路千禧社區旁的眷村故事館，早期為龜山區陸光三村自治會辦公室，是眷村活動集會的重要場所，經在地居民共同保存成為情感交流的好所在。桃園市政府文化局為保存眷村文化資產精神，2004年登錄歷史建築，定名為「龜山眷村故事館」，成為陸光三村改建後唯一保留的老眷村建築。在故事館內，著重在保存這段特殊的眷村歷史，以人物為主軸，展示物件為輔，從文化分析的觀點帶領遊客認識眷村，期盼透過歷史的回溯，重新詮釋在龜山這段重要的文史發展；因此，整座故事館未進行任何拆除的工程來保留建物原貌，並改採添建陳設材料的方式，創造眷村文化再生環境。在內部陳設上，除了把近年來在龜山收集到的眷村田調文史資料，透過紀錄片及聲音箱的方式呈現，讓大家更能體會到眷村生活的真實面，更特別的是，規劃單位還設計出可摺疊移動的「故事箱」，讓每個人、每個家庭的寶貝故事，都有一處屬於自己的展示空間。館內除了有眷村生活導覽展示之外，在各主題區還設計了許多讓參觀的遊客可以一同參與的眷村互動遊戲，讓大家輕鬆認識眷村的美好事物。除了實境呈現眷村文化外，每年約10月都會在此舉辦「眷村文化節」的活動，內容包括眷村美食、文物特展、影片回顧、團體表演、園遊會、手工藝DIY、故事記錄等，要讓各世代不同的族群都能體會屬於眷村的感動。就像從開始踏入陌生的村子，拿起紙、筆記錄伯伯、阿姨們的故事那一刻起，我們彼此的生命軌跡，在不知不覺中擁有了共同的生活記憶，也在不知不覺中在龜山多了好幾個家，現在，「眷村故事館」就是我們幫伯伯、阿姨們的生命故事所找到的溫暖的家，歡迎大家一同來此聆聽龜山的故事、眷村的故事，並將這些故事說給龜山人聽、說給外地人聽、說給我們的下一代聽，讓眷村文化得以永續經營。,舊皮箱、縫紉機、黑膠唱片、黑白電視機…穿梭眷村客廳、雜貨店，每一件看似不起眼的生活物品，都是一個個50﹣60年代的動人故事。,886-3-3296662,桃園市333龜山區光峰路43號,333.0,桃園市,龜山區,在桃園火車站前遠東百貨公司門口搭乘桃園客運（桃園往光華坑-林口約10-20分鐘一班)於千禧新城站（車經萬壽路左轉大同路遇龜山國中右轉）下車，再往回步行約1-3分鐘至千禧新城警衛室大榕樹過馬路可抵。,週三~週日 10:00~17:00國定假日照常開館,https://travel.tycg.gov.tw/content/images/attractions/40424/640x480_attractions-image-5t6c9iih3e6gsarewa1afa.jpg,眷村故事館,,,,,,376430000A,121.34046,24.99847,,1,,,,,路邊停車,,,免費,￭不定期舉辦創意市集、讀書會...等各項活動，詳情請上官網查詢。￭團體預約導覽可於參觀前一週電洽03-3296662，導覽時間約30分鐘，多於25人須分批導覽。,,2022/3/6 12:02,"['眷村', '故事', '龜山', '歷史', '我們', '說給', '文化', '三村', '龜山區', '陸光', '活動', '成為', '建築', '館內', '這段', '呈現', '每個', '不覺', '展示', '保存', '阿姨', '文史', '伯伯', '除了', '大家', '一同', '生活', '建物', '保留', '特展', '生命', '添建', '美好事物', '光峰', '路千禧', '社區', '會辦', '集會', '場所', '經在', '桃園', '資產', '2004', '登錄', '著重', '為主軸', '為輔', '觀點', '領遊客', '認識', '透過', '詮釋', '發展', '進行', '並改採', '創造', '環境', '內部', '設上', '田調', '資料', '透過紀', '錄片', '及聲', '體會', '實面', '更特別', '規劃', '單位', '還設', '計出', '移動', '寶貝', '一處屬', '空間', '導覽', '各主題', '區還', '設計', '許多', '參觀', '遊客', '參與', '互動', '遊戲', '實境', '10', '舉辦', '內容', '回顧', '團體', '園遊會', 'DIY', '記錄', '體會屬', '感動', '開始', '起紙', '筆記錄', '軌跡', '擁有', '記憶', '幾個', '現在', '溫暖', '歡迎', '來此', '並將', '這些', '龜山人', '永續', '經營', '公室', '共同', '回溯', '文化局', '音箱', '族群', '一刻起', '原貌', '不知', '外地人', '踏入', '方式', '整座', '美食', '期盼', '下一代', '更能', '物件', '拆除', '定名', '改建', '世代', '再生', '重要', '手工', '陌生', '近年', '自治', '村子', '情感', '文物', '市政府', '影片', '收集', '表演', '彼此', '交流', '所在']",2022
C1_376430000A_001008,龜山楓樹坑步道,,楓樹坑登山步道是桃園虎頭山眾多登山步道之一，登山入口就位於楓樹村光峰路 281巷的巷底，由此進入後，會先經過楓樹國小的側門，再由福德宮旁的車道續往上行，即可抵達主祀玄天上帝的真武殿，殿內環境清幽，也是一處參訪的好地點，廟旁有條筆直的枕木階梯就是楓樹坑登山步道的起點。沿著枕木階梯續往上行，穿越樹林後，就會來到一整片的芒草林，每到深秋的季節就是賞芒的最佳時機，此時的芒花處處盛開，飄逸的白色花穗特別引人注目，白茫茫的一片就彷彿是翻飛的雲海，堪稱是入秋後最美的景觀。除了觀賞之用，也別小看了這身形優雅的芒草，芒草本身是陽性先驅植物，在茂密的樹林裡是看不到它的蹤影，只有在陽光充足的裸露土地上才能生長，用其堅韌的生命力保護著這片土地，緊緊抓住土壤，而不用擔心一旦颳風下雨造成的土石流災害。離開了隨風搖曳的芒花，映入眼簾的是位於置高點的龜山六號涼亭，這裡可說是眺望山景的絕佳地點，步上涼亭往下眺望，視野寬闊，不但可以欣賞楓樹國小的全景、山下市區屋舍林立，運氣好的話還可以遠眺台北101高樓；四處觀望，可見虎頭山及新路坑山的山景，秋天則加碼演出隨著季節轉換成芒花搖曳的浪漫景致，頗令人驚艷。離開了視野寬闊的六號涼亭，走在寬闊的土石路上，不用擔心腳下路況崎嶇難行，仍可延續自涼亭一路行來的自然景致，遠山近草都可盡入眼簾，不費勁就能輕鬆享受盎然綠意。在經過電塔與果園後，就可以看到一大片寬廣的紅土廣場，這個平台就是多條登山步道的匯集處「停機坪」，這裡除了可停放直昇機外，假日就成為了遙控飛機玩家的大本營；也由於是多條山路的交會點，岔路分別通往虎頭山環保公園、虎頭山公園、楓樹坑等地，遊客可選擇從15號電塔方向轉折下行，沿途可回望剛剛經過的6號涼亭與新路坑山北峰，風景十分秀麗。下山時，明倫三聖宮的琉璃屋瓦伴隨著翠綠山林更顯得耀眼奪目，山下的仿歐式建築也頗具特色。步道的盡頭就是以花海聞名的楓樹村，可順路賞遊，為這段親山步道畫下完美的句點。,全程約3公里的步道，沿途自然林相豐富，除了各類常綠喬木，還有油桐、山櫻、山芙蓉、月桃、芒草等植物點綴四季風景，至高處可遠眺大棟山。,886-3-3322101,桃園市333龜山區楓樹里光峰路281巷12弄,333.0,桃園市,龜山區,可至龜山區公所，搭乘 「中坑線」免費小型公車，至楓樹國小站下車，步行可抵。,全年無休,https://travel.tycg.gov.tw/content/images/attractions/10791/640x480_files635866513809852348.jpg,福德宮旁的枕木階梯,,,,,,376430000A,121.34325,25.00633,,11,,,,,路邊停車,,,免費,位於楓樹村內，秋冬時節可順遊美麗花海。,,2022/11/1 16:29,"['步道', '虎頭', '登山', '楓樹坑', '芒草', '涼亭', '寬闊', '楓樹村', '地點', '季節', '擔心', '離開', '這裡', '視野', '坑山', '經過', '多條', '山景', '枕木', '土石', '新路', '眺望', '景致', '山下', '就是', '一整片', '上行', '花穗', '可延', '不用', '桃園', '山眾', '光峰路', '281', '巷底', '進入', '先經', '過楓', '樹國', '側門', '福德宮', '車道續', '抵達', '主祀', '玄天', '殿內', '環境', '一處', '參訪', '有條', '筆直', '階梯', '起點', '沿著', '階梯續', '樹林', '賞芒', '時機', '此時', '花處', '處盛開', '飄逸', '特別', '翻飛', '雲海', '堪稱', '景觀', '觀賞', '優雅', '陽性', '先驅', '樹林裡', '陽光', '生長', '堅韌', '保護著', '這片', '緊緊', '流災害', '隨風搖曳', '眼簾', '高點', '山六號', '絕佳', '步上', '欣賞', '楓樹國', '市區', '運氣', '話還', '遠眺', '101', '高樓', '四處', '觀望', '可見', '山及', '則加碼', '隨著', '轉換', '成芒', '花搖曳', '驚艷', '六號', '腳下', '路況', '崎嶇', '難行', '自涼亭', '遠山近', '不費勁', '綠意', '電塔', '果園', '寬廣', '紅土', '廣場', '這個', '匯集處', '停機', '機外', '成為', '遙控', '飛機', '大本營', '交會點', '分別', '山環', '保公園', '山公園', '遊客', '可選擇', '15', '號電塔', '轉折', '剛剛', '號涼亭', '風景', '秀麗', '明倫三聖宮', '隨著翠綠', '顯得', '奪目', '歐式', '建築', '盡頭', '聞名', '可順路', '賞遊', '這段']",2022
C1_376430000A_001009,虎頭山公園,,虎頭山公園座落於桃園市郊成功路三段臨南崁溪處，每天都有許多居民來公園運動晨操，假日的人潮更是暴增，連來自龜山、八德、中壢、桃園、蘆竹之民眾都愛到此健行休閒。目前已從現有的15公頃公園擴大為720公頃的風景特定區，區內規劃虎頭山、楓樹坑二大遊憩系統、三大登山系統，將虎頭山打造成北台灣重要的都會公園。三大登山系統包含虎頭山公園內的前山步道系統(含全齡友善步道、環狀步道)、與虎頭山公園外的後山環山步道和桃11線道路系統。虎頭山公園鄰近桃園市區，地勢居高臨下，為城市景觀保留了豐沛綠意，而享有「桃園後花園」的美譽。公園內規劃有多條步道系統，以顏色作為路線區分，除了園區的人行步道外，另外完整規劃出包括賞景健康步道、櫻花步道、森林體驗步道、太陽亭步道、梅園步道、生態解說步道、忠烈祠步道等七條環狀登山步道，讓遊客更容易探訪虎頭山的美景全貌。此外，前山系統另包含以架高工法打造的全齡友善步道，不僅保護動植物的原有生長環境，也提供爬山者較為舒適的健行體驗。全長共20公里的後山環山步道，由桃園區成功路沿途行經桃11線道路、龜山區苗圃道路、中坑街、光峰路，再由台一線串回原點。而促進桃林鐵路活化的桃11線道路系統，包含以無障礙坡道串連虎頭山公園與忠烈祠的虎嶺迎風步道、以及可連接虎頭山環保公園的三元步道、水汴頭步道。,想要親近山林不一定非要舟車勞頓，桃園市心後花園完善的步道系統，滿足想兜風、練腿力、賞桐花，或是來個生態之旅的你。,886-3-3946061,桃園市330桃園區成功路三段,330.0,桃園市,龜山區,由桃園復興路搭乘公車105號公車，在「桃園高中」站或「虎頭山公園」站下車，步行約5分鐘。,全年無休,https://travel.tycg.gov.tw/content/images/attractions/60021/640x480_attractions-image-b-v0vfxhzkg7tk7sf0iaeg.jpg,虎頭山公園,,,,,,376430000A,121.33002,24.99996,,11,,,,,備有停車場。,,,免費,■步道系統眾多，可依自身體力考量選擇適合的步道前往。■山區蚊蟲多，請著透氣長袖衣褲■假日遊客較多，建議搭乘大眾運輸,,2022/3/6 12:02,"['系統', '山公園', '步道', '虎頭', '桃園', '公園', '規劃', '11', '登山', '忠烈祠', '健行', '道路', '公頃', '虎頭山', '三大', '全齡', '環山步', '包含', '友善', '高工', '道外', '臨南', '許多', '來公園', '運動', '晨操', '連來', '自龜山', '八德', '中壢', '蘆竹', '之民眾', '愛到', '休閒', '現有', '15', '擴大為', '720', '風景', '區內', '楓樹坑', '二大遊', '憩系統', '將虎頭', '環狀步', '鄰近', '市區', '地勢', '居高臨', '景觀', '豐沛', '綠意', '桃園後花園', '美譽', '條步', '以顏色', '路線', '區分', '園區', '賞景', '櫻花步', '體驗步', '太陽亭', '梅園步', '生態', '解說', '七條', '環狀', '遊客', '探訪', '以架', '不僅', '保護動', '生長', '環境', '舒適', '體驗', '全長', '20', '由桃園區', '行經桃', '龜山區', '中坑', '光峰路', '一線', '串回', '原點', '促進', '鐵路', '以無障礙', '串連虎頭', '虎嶺', '迎風步', '可連', '接虎頭', '山環', '保公園', '水汴頭步', '北台', '行步', '座落', '桃林', '前山', '人潮', '成功', '苗圃', '三段', '坡道', '爬山', '全貌', '暴增', '活化', '美景', '山系', '三元', '假日', '市郊', '沿途', '打造', '享有', '特定', '原有', '保留', '完整', '森林', '公里', '健康', '更是', '居民', '每天', '植物', '容易', '除了', '造成', '另外', '城市', '此外', '提供', '包括', '重要', '以及', '目前']",2022
C1_376430000A_001274,大棟山登山步道,,名列台灣小百岳之一的大棟山，海拔高達405公尺，位於龜山龜崙嶺的制高點，又稱405高地，設有一等三角點，此處坐擁極佳視野，除了可盡覽大桃園城市風光，因位置恰處龜山、樹林、山佳、鶯歌四地交界，還能一望新北市，甚至是台北101，因此不論白天或是夜晚，大棟山總吸引許多登山客、攝影行家前來。大棟山具有多個入山口，若從圓光橋出發，可沿著福源山步道爬坡至大棟山路，約4.3公里即可抵405高地。行程前段岔路-石雲路，可通往已建廟百年的石雲禪寺；精緻的交趾陶、高聳的牌樓、與陡峭的石階，瀰漫著莊嚴氣氛。廟埕前的九芎、樟樹和茄苳樹，皆是百年老樹，濃濃綠蔭，讓旅人的心在此寧靜停泊。返回大同路，沿途行經虛空禪寺，以及錯落於山間的土雞城，便是大棟山405高地。另一通往高地的路線則由兔坑產業道路一路行經基礎忠恕道院、千佛寺等宗廟，全長約3.2公里，沿途盡是豐富的天然原始林。  405高地除了設置觀景台，並有三角點及水文觀測站的介紹看板。向東可遠眺雪山山脈、大漢溪，向西是觀音山、林口，向南是中壢、復興山區，向北是淡水河、圓山飯店。攻頂的深刻感動，與芬多精的洗滌，讓健走的疲憊消失殆盡。大棟山豐富的生態也是旅程的亮點之一；春夏之際常見鳳蝶、紫蛺蝶飛舞之姿，秋日芒草搖曳，冬天楓紅浪漫。405高地除了可串聯大同山登山步道至青龍嶺，也可至關公嶺賞蝶步道，欣賞多達30餘種的野生蝴蝶。,目睹海拔405公尺的小百岳風景，有飛機凌空飛、高鐵呼嘯過、蜿蜒淡水河、台北101屹立遠處，攻頂後的重頭戲，就是令人直呼值得。,886-3-3322101,桃園市333龜山區兔坑村,333.0,桃園市,龜山區,搭乘桃園客運5064線【桃園－三德煤礦(經龜山圓光橋)】至圓光橋站或福山宮站下,全年無休,https://travel.tycg.gov.tw/content/images/attractions/18845/640x480_files636173260895963710.jpg,405高地,,,,,,376430000A,121.35788,24.9927,,11,,,,,路邊停車,,,免費,石雲路為狹窄陡坡，不易會車,,2022/6/23 16:49,"['405', '高地', '大棟山', '龜山', '豐富', '登山', '沿途', '三角', '除了', '通往', '看板', '步道', '福源', '公里', '台灣', '小百岳', '高達', '龜崙嶺', '制高點', '設有', '此處', '擁極佳視野', '可盡覽', '大桃園', '風光', '恰處', '樹林', '山佳', '歌四地', '還能', '新北市', '101', '不論', '大棟', '許多', '攝影', '前來', '多個', '圓光橋', '出發', '沿著', '山步', '至大棟', '4.3', '石雲路', '已建廟', '石雲禪', '高聳', '牌樓', '石階', '漫著莊', '嚴氣氛', '樟樹', '濃濃綠蔭', '此寧靜', '行經', '虛空', '禪寺', '錯落', '山間', '土雞城', '路線則', '坑產業', '經基礎', '等宗廟', '全長', '3.2', '盡是', '設置', '觀景台', '並有', '點及', '觀測', '介紹', '向東', '可遠眺', '雪山山', '大漢溪', '觀音山', '中壢', '興山區', '圓山', '飯店', '攻頂', '感動', '芬多精', '洗滌', '疲憊', '殆盡', '生態', '亮點', '之際常見', '鳳蝶', '飛舞', '之姿', '芒草', '搖曳', '楓紅', '可串', '青龍嶺', '關公嶺', '賞蝶步', '欣賞', '30', '餘種', '忠恕', '百年老', '林口', '大同路', '一路行', '道院', '原始林', '淡水河', '秋日', '旅人', '公尺', '交趾', '前段', '爬坡', '岔路', '旅程', '春夏', '行家', '之一', '佛寺', '停泊', '一望', '名列', '蝴蝶', '一等', '陡峭', '浪漫', '台北', '交界', '山口', '山路', '向西', '水文', '百年', '大同', '野生', '行程', '向北', '夜晚', '冬天', '白天', '即可', '深刻', '或是', '返回']",2022
